{
  "taskId": "d1t6",
  "taskTitle": "Build a Team",
  "domain": "People",
  "quickScenarioChallenge": {
    "challengeSubtitle": "Don't worry if you get it wrong‚Äîthat's how you learn!",
    "scenarioStory": "You're starting a new software development project. HR gives you a list of 15 available developers. You can select anyone, but you notice that while some have excellent technical skills, they have poor collaboration skills. Others are great team players but lack some technical expertise. You need a team of 8 developers.",
    "question": "What should guide your team selection FIRST?",
    "options": {
      "A": "Select the 8 developers with the highest technical skills regardless of personality",
      "B": "Select based on project needs, considering both technical skills AND ability to work collaboratively",
      "C": "Let the developers self-select into teams based on their preferences",
      "D": "Select the 8 developers with the most experience"
    },
    "correctAnswer": "B"
  },
  "ahaDebrief": {
    "correctAnswer": "B - Balance technical skills AND collaboration ability",
    "whySection": {
      "insights": [
        {
          "principle": "Not Everyone is Good for Every Team",
          "explanation": "Team composition matters. The best individual performers don't always make the best team. Balance skills, personalities, and collaboration ability.",
          "pmbokSupport": "High-performing teams require both competence and collaboration"
        },
        {
          "principle": "Match Team to Project",
          "explanation": "Different projects need different team compositions. Consider project type, complexity, and stakeholder expectations when building the team.",
          "pmbokSupport": "Teams should match the specific needs and expectations of stakeholders"
        },
        {
          "principle": "Development vs. Selection",
          "explanation": "Sometimes you select the team (ideal). Sometimes the team is assigned to you (common). Either way, you must develop them into a high-performing unit.",
          "pmbokSupport": "Project managers develop teams regardless of how they're formed"
        }
      ]
    },
    "trapSection": {
      "explanation": "Building a team isn't just about finding the best individuals‚Äîit's about creating a cohesive, collaborative unit.",
      "trapTable": [
        {
          "option": "A - Only technical skills",
          "violation": "Ignores collaboration and team dynamics",
          "pmiValueBroken": "Technical brilliance without teamwork creates conflict and dysfunction"
        },
        {
          "option": "C - Self-selection",
          "violation": "Abdicates leadership responsibility for team composition",
          "pmiValueBroken": "May create cliques or imbalanced teams"
        },
        {
          "option": "D - Only experience",
          "violation": "Experience doesn't guarantee fit for this specific project",
          "pmiValueBroken": "Overvalues tenure, undervalues project-specific needs"
        }
      ]
    },
    "patternRecognition": {
      "checklist": [
        "What are the project-specific needs?",
        "Do candidates have needed technical skills?",
        "Can they work collaboratively?",
        "Is there balance and diversity in the team?"
      ],
      "patternRule": "Project needs ‚Üí Match skills + collaboration + diversity. If team is assigned (can't select) ‚Üí Develop them into high performers."
    }
  },
  "coreFramework": {
    "frameworkName": "B.U.I.L.D. Framework for Team Formation",
    "frameworkIntro": "Building a high-performing team requires intentional design and development:",
    "frameworkTable": {
      "columns": ["Step", "Action", "Key Questions", "Exam Keywords"],
      "rows": [
        {
          "step": {
            "badge": "B",
            "name": "Blueprint Project Needs",
            "color": "#3b82f6"
          },
          "action": "Define what this specific project needs. Technical skills? Domain knowledge? Agile experience? Regulatory expertise? Not all teams fit all projects.",
          "keyQuestions": [
            "What skills does THIS project require?",
            "Agile, traditional, or hybrid approach?",
            "What domain knowledge is critical?",
            "What's the complexity and risk level?"
          ],
          "examKeywords": "Project requirements, Skills needed, Technical competencies, Domain expertise"
        },
        {
          "step": {
            "badge": "U",
            "name": "Understand Available Talent",
            "color": "#8b5cf6"
          },
          "action": "Assess who's available (if selecting) or who's assigned (if team is given). Understand their skills, personalities, strengths, and collaboration abilities.",
          "keyQuestions": [
            "Can I select the team or is it assigned?",
            "What are each person's technical skills?",
            "How well do they collaborate?",
            "What are their working styles and preferences?"
          ],
          "examKeywords": "Assess talent, Skills inventory, Team composition, Available resources"
        },
        {
          "step": {
            "badge": "I",
            "name": "Integrate Diversity",
            "color": "#10b981"
          },
          "action": "Build diversity of thought, background, and perspective. Diverse teams innovate better and catch more blind spots. Balance experience levels.",
          "keyQuestions": [
            "Do we have cognitive diversity?",
            "Mix of junior and senior members?",
            "Different backgrounds and perspectives?",
            "Inclusive environment for all?"
          ],
          "examKeywords": "Diversity, Inclusion, Different perspectives, Balance, Cognitive diversity"
        },
        {
          "step": {
            "badge": "L",
            "name": "Launch Team Development",
            "color": "#f59e0b"
          },
          "action": "Develop the team through Forming ‚Üí Storming ‚Üí Norming ‚Üí Performing. Facilitate team charter, ground rules, working agreements. Build cohesion.",
          "keyQuestions": [
            "What stage is the team in (Tuckman)?",
            "Do we have a team charter?",
            "Are ground rules established?",
            "How can we accelerate to performing?"
          ],
          "examKeywords": "Team development, Tuckman stages, Team charter, Ground rules, Cohesion"
        },
        {
          "step": {
            "badge": "D",
            "name": "Deliver Through Collaboration",
            "color": "#ec4899"
          },
          "action": "Foster collaboration, trust, and shared accountability. Remove silos. Celebrate wins together. Make the team greater than the sum of individuals.",
          "keyQuestions": [
            "Is the team collaborating effectively?",
            "Do they trust each other?",
            "Shared accountability or finger-pointing?",
            "Are we leveraging collective intelligence?"
          ],
          "examKeywords": "Collaboration, Trust, Shared accountability, Team synergy, Collective intelligence"
        }
      ]
    },
    "additionalContent": {
      "tuckmanStages": {
        "forming": "Team members are polite, getting to know each other. Low productivity.",
        "storming": "Conflicts emerge as personalities clash. Critical to navigate well.",
        "norming": "Team establishes norms and working agreements. Productivity increases.",
        "performing": "High trust, high performance. Team is self-organizing.",
        "adjourning": "Project ends, team disbands. Celebrate and capture lessons."
      },
      "selectionCriteria": [
        "Technical skills match project needs",
        "Collaboration and communication ability",
        "Availability and commitment level",
        "Diversity of thought and background",
        "Balance of experience levels",
        "Cultural fit and values alignment"
      ]
    },
    "pmbokConnection": {
      "performanceDomain": "Team Performance Domain",
      "principle": "Principle 6: Demonstrate Leadership Behaviors",
      "quote": "Not everyone is good for every team, and not every team is good for every project. Teams should be built with intention and developed continuously."
    }
  },
  "visualReferenceCard": {
    "taskTitle": "Build a Team",
    "framework": {
      "acronym": "B.U.I.L.D.",
      "steps": [
        "üìã Blueprint project needs",
        "üë• Understand available talent",
        "üåà Integrate diversity",
        "üöÄ Launch team development",
        "ü§ù Deliver through collaboration"
      ]
    },
    "quickReference": "**Selection:** Skills + Collaboration + Diversity | **Development:** Forming ‚Üí Storming ‚Üí Norming ‚Üí Performing | **Key:** Not all teams fit all projects",
    "goldenRule": "Best individuals ‚â† Best team. Build for collaboration AND competence.",
    "examTip": "Look for: 'building a team,' 'team composition,' 'assigned vs. selected' ‚Üí Answer balances skills + collaboration + diversity. Remember Tuckman stages.",
    "pmbokPrinciple": "Principle 6: Demonstrate Leadership - Build and develop effective teams"
  },
  "secondScenario": {
    "title": "üéØ Apply the B.U.I.L.D. Framework",
    "intro": "Apply the framework:",
    "scenarioStory": "You're assigned a team of 10 people for a mobile app project. You didn't select them‚ÄîHR assigned them based on availability. The team has never worked together before. Three members are experienced iOS developers, two are Android experts, three are backend developers, and two are new graduates. Personalities range from introverted to very outspoken. The project kicks off in one week.",
    "question": "Following B.U.I.L.D., what should you do FIRST?",
    "options": {
      "A": "Request to replace the new graduates with experienced developers",